<?xml version="1.0" encoding="UTF-8"?>
<messages xmlns:xsi="http://www.w3.org/2001/XMLSchema-instance"
xsi:noNamespaceSchemaLocation="ex05_01.xsd">
<message numero="1" date="2021-01-01">
<dest>promo2021</dest>
<dest >Pierre Nerzic</dest>
<contenu>Bonne année !</contenu>
</message>
<message numero="2">
<dest>promo2021</dest>
<contenu>Bonne rentrée !</contenu>
</message>

</messages>